{
  "schema_version": "1.0",
  "review_id": "gradient-descent-p2-computer-science-run-01-review-v1",
  "review_status": "revision_required",
  "candidate_binding": {
    "pathway_id": "gradient-descent-p2-computer-science-run-01",
    "pathway_file": "experiments/rq2/pathway-plans/gradient-descent-v1/p2/computer-science/run-01/pathway-plan.json",
    "pathway_sha256": "590bdcf13f00de86aa099d5909dc57f8677e6dcf5236f73890716ca1c1091ec9",
    "validation_report_file": "experiments/rq2/pathway-plans/gradient-descent-v1/p2/computer-science/run-01/pathway-validation-report.json",
    "validation_report_sha256": "1ed46113c7d8d591a44a341fe04e21e4e8099b072c4768a2c2dbc64d0a10bb83",
    "assessment_id": "gradient-descent-computer-science-year-2-concept-assessment-v1",
    "assessment_file": "experiments/rq2/pathway-plans/gradient-descent-v1/p2/computer-science/run-01/profile-concept-assessment.json",
    "assessment_sha256": "0c52d79feba31930bc796990947e6781c91c157b3603bed2025e2d92a34e14ec",
    "profile_id": "gradient-descent-computer-science-year-2-rq2-pilot",
    "profile_file": "experiments/rq2/profiles/gradient-descent/computer-science-year-2.json",
    "profile_sha256": "99474bea6b136bbe548c33273246c7525cd4fc8e28d01f47e02f17d2d54596c2"
  },
  "template_generator": {
    "agent": "adaptive-curriculum-pathway-planner",
    "agent_version": "1.1",
    "skill": "plan-adaptive-curriculum-pathways",
    "skill_version": "1.1",
    "generated_at": "2026-08-19T21:10:21Z"
  },
  "revision_binding": null,
  "reviewer": {
    "reviewer_id": "reviewer-001",
    "reviewer_role": "computer science educator"
  },
  "selection_reviews": [
    {
      "item_id": "RC-001",
      "item_type": "definition",
      "criticality": "critical",
      "planned_decision": "include",
      "planned_role": "target",
      "field_decisions": {
        "decision_and_role": "approved",
        "rationale_and_profile_basis": "approved"
      },
      "decision": "approved",
      "comment": null
    },
    {
      "item_id": "RC-002",
      "item_type": "theorem",
      "criticality": "critical",
      "planned_decision": "include",
      "planned_role": "supporting",
      "field_decisions": {
        "decision_and_role": "approved",
        "rationale_and_profile_basis": "approved"
      },
      "decision": "approved",
      "comment": null
    },
    {
      "item_id": "RC-003",
      "item_type": "theorem",
      "criticality": "critical",
      "planned_decision": "exclude",
      "planned_role": null,
      "field_decisions": {
        "decision_and_role": "approved",
        "rationale_and_profile_basis": "approved"
      },
      "decision": "approved",
      "comment": null
    },
    {
      "item_id": "RC-004",
      "item_type": "definition",
      "criticality": "critical",
      "planned_decision": "include",
      "planned_role": "target",
      "field_decisions": {
        "decision_and_role": "approved",
        "rationale_and_profile_basis": "approved"
      },
      "decision": "approved",
      "comment": null
    },
    {
      "item_id": "RC-005",
      "item_type": "theorem",
      "criticality": "critical",
      "planned_decision": "include",
      "planned_role": "supporting",
      "field_decisions": {
        "decision_and_role": "approved",
        "rationale_and_profile_basis": "approved"
      },
      "decision": "approved",
      "comment": null
    },
    {
      "item_id": "RC-006",
      "item_type": "definition",
      "criticality": "critical",
      "planned_decision": "include",
      "planned_role": "target",
      "field_decisions": {
        "decision_and_role": "approved",
        "rationale_and_profile_basis": "approved"
      },
      "decision": "approved",
      "comment": null
    },
    {
      "item_id": "RC-007",
      "item_type": "definition",
      "criticality": "critical",
      "planned_decision": "include",
      "planned_role": "target",
      "field_decisions": {
        "decision_and_role": "approved",
        "rationale_and_profile_basis": "approved"
      },
      "decision": "approved",
      "comment": null
    },
    {
      "item_id": "RC-008",
      "item_type": "theorem",
      "criticality": "required",
      "planned_decision": "exclude",
      "planned_role": null,
      "field_decisions": {
        "decision_and_role": "approved",
        "rationale_and_profile_basis": "approved"
      },
      "decision": "approved",
      "comment": null
    },
    {
      "item_id": "RC-009",
      "item_type": "definition",
      "criticality": "required",
      "planned_decision": "include",
      "planned_role": "target",
      "field_decisions": {
        "decision_and_role": "approved",
        "rationale_and_profile_basis": "approved"
      },
      "decision": "approved",
      "comment": null
    },
    {
      "item_id": "RC-010",
      "item_type": "algorithm_rule",
      "criticality": "critical",
      "planned_decision": "include",
      "planned_role": "target",
      "field_decisions": {
        "decision_and_role": "approved",
        "rationale_and_profile_basis": "approved"
      },
      "decision": "approved",
      "comment": null
    },
    {
      "item_id": "RC-011",
      "item_type": "algorithm_rule",
      "criticality": "required",
      "planned_decision": "include",
      "planned_role": "target",
      "field_decisions": {
        "decision_and_role": "approved",
        "rationale_and_profile_basis": "approved"
      },
      "decision": "approved",
      "comment": null
    },
    {
      "item_id": "RC-012",
      "item_type": "algorithm_rule",
      "criticality": "required",
      "planned_decision": "exclude",
      "planned_role": null,
      "field_decisions": {
        "decision_and_role": "approved",
        "rationale_and_profile_basis": "approved"
      },
      "decision": "approved",
      "comment": null
    },
    {
      "item_id": "RC-013",
      "item_type": "algorithm_rule",
      "criticality": "required",
      "planned_decision": "include",
      "planned_role": "supporting",
      "field_decisions": {
        "decision_and_role": "approved",
        "rationale_and_profile_basis": "approved"
      },
      "decision": "approved",
      "comment": null
    },
    {
      "item_id": "RC-014",
      "item_type": "convergence_result",
      "criticality": "critical",
      "planned_decision": "include",
      "planned_role": "target",
      "field_decisions": {
        "decision_and_role": "approved",
        "rationale_and_profile_basis": "revision_required"
      },
      "decision": "revision_required",
      "comment": "Keep RC-014 included as a target, but revise its rationale. The current rationale says that an exact fallback is recorded even though RC-005 remains selected; an omission fallback is only warranted when its explanatory dependency is omitted. State instead that RC-005 supplies the descent mechanism and RC-014 uses the selected smoothness, convexity, update, and step-size items to interpret the O(1/k) guarantee at concise proof depth suitable for this profile."
    },
    {
      "item_id": "RC-015",
      "item_type": "convergence_result",
      "criticality": "critical",
      "planned_decision": "include",
      "planned_role": "target",
      "field_decisions": {
        "decision_and_role": "approved",
        "rationale_and_profile_basis": "approved"
      },
      "decision": "approved",
      "comment": null
    },
    {
      "item_id": "RC-016",
      "item_type": "algorithm_rule",
      "criticality": "critical",
      "planned_decision": "exclude",
      "planned_role": null,
      "field_decisions": {
        "decision_and_role": "approved",
        "rationale_and_profile_basis": "approved"
      },
      "decision": "approved",
      "comment": null
    },
    {
      "item_id": "RC-017",
      "item_type": "convergence_result",
      "criticality": "required",
      "planned_decision": "exclude",
      "planned_role": null,
      "field_decisions": {
        "decision_and_role": "approved",
        "rationale_and_profile_basis": "approved"
      },
      "decision": "approved",
      "comment": null
    },
    {
      "item_id": "RC-018",
      "item_type": "algorithm_rule",
      "criticality": "critical",
      "planned_decision": "exclude",
      "planned_role": null,
      "field_decisions": {
        "decision_and_role": "approved",
        "rationale_and_profile_basis": "approved"
      },
      "decision": "approved",
      "comment": null
    },
    {
      "item_id": "RC-019",
      "item_type": "convergence_result",
      "criticality": "critical",
      "planned_decision": "exclude",
      "planned_role": null,
      "field_decisions": {
        "decision_and_role": "approved",
        "rationale_and_profile_basis": "approved"
      },
      "decision": "approved",
      "comment": null
    },
    {
      "item_id": "RC-020",
      "item_type": "assumption",
      "criticality": "critical",
      "planned_decision": "exclude",
      "planned_role": null,
      "field_decisions": {
        "decision_and_role": "approved",
        "rationale_and_profile_basis": "approved"
      },
      "decision": "approved",
      "comment": null
    },
    {
      "item_id": "RC-021",
      "item_type": "algorithm_rule",
      "criticality": "critical",
      "planned_decision": "exclude",
      "planned_role": null,
      "field_decisions": {
        "decision_and_role": "approved",
        "rationale_and_profile_basis": "approved"
      },
      "decision": "approved",
      "comment": null
    },
    {
      "item_id": "RC-022",
      "item_type": "convergence_result",
      "criticality": "critical",
      "planned_decision": "exclude",
      "planned_role": null,
      "field_decisions": {
        "decision_and_role": "approved",
        "rationale_and_profile_basis": "approved"
      },
      "decision": "approved",
      "comment": null
    },
    {
      "item_id": "RC-023",